bgg_id,image,description
12308,https://cf.geekdo-images.com/AeJlmNyz15g0Ytb1pWQwzw__original/img/cLKcU2EJ7p7oe7ojcfVVTvlD9ec=/0x0/filters:format(jpeg)/pic135907.jpg,"From the box:&#10;In the beginning those that could master going between dimensions thought of it as novelty. There were worlds to discover, creatures to see and most importantly magic to master. But with all these things to keep them busy there was one thing they did not forget, Power. Soon it was easier to take from others than to find it on your own. The only place to hide was in great magical towers that they built between dimensions. All times in your world and in the others are at your disposal.&#10;&#10;Will you be the last to Reign in Towers in Time?&#10;&#10;Play overview:&#10;Each player represents a spellcaster, dueling with the other players for control of an abstractly defined extradimensional space.  Each player has five shields, represented by cards from that player's deck, that serve to anchor the player the dimension within the game's story, and as the player's presence in the game mechanically.  The goal is to eliminate the shields of all other players; when a player has no shields remaining, they are banished from the pocket dimension, and out of the game.  Victory goes to the last player with shields in play.&#10;&#10;To combat one another, players play Source cards, representing connections to various natural locations, be they landforms, weather phenomena, or natural disasters.  These resource cards allow the player to access Temper, the main resource in Towers in Time, themed to the four elements.  Using Temper, players pay the costs to summon creatures to wage war, conjure magical objects and artifacts to enhance the effectiveness of recruited creatures, and cast spells to strengthen their minions and weaken the opposing armies.  Additionally, once creatures are in play, most of them can provide Temper as well, although typically less than Source cards; most cards in Towers in Time are resource generators in addition to their other game effects.&#10;&#10;Source cards serve as the base for the titular Towers of Towers in Time.  Each Source has a default file of three ranks atop it, each space of which can be occupied by creatures and the cards they carry.  Creatures enter play within Towers, and must match the element represented by the Source atop which it stands (except for Neutral creatures, which may be played into any Tower).  There are rules to determine which creatures can enter play in which locations within a Tower, but once in play, most creatures can move between Towers, taking attached cards with them when they move.&#10;&#10;Turns do not follow the turn format common to many contemporary CCGs.  Instead, several phases are completed simultaneously by all players, then players alternate initiating and resolving a single action until both players have passed.  Action resolution varies depending on their effect, with some actions initiating a separate resolution phase with its own actions and timing (such as combat) and others are single-step actions (such as playing a card).  Additionally, a number of supplemental actions (&quot;free&quot; actions) facilitate utility functions, such as drawing Temper to pay for spells.  The opportunity to act first during the action round is determined by the player who won initiative during game setup (for the first turn only), or the player who did not take the last pass action on the previous turn.&#10;&#10;"
12309,,"From the box:&#10;&quot;Wanna shag...?&quot;Welcome to the Austin Powers CCG, a shagadelic, multi-player gaming experience. This cheeky little box contains two, 30 card pre-constructed decks ready to play.&#10;Collect all 140 groovy cards from &quot;The Spy Who Shagged Me&quot; depicting your favorite characters, scenes and quotes from the movie. Choose cards from your collection to customize your own smashing decks and have a swinging good time with a bunch of your friends. Oh, Behave!&#10;&#10;"
12310,https://cf.geekdo-images.com/KIegldC0S80kCWE2Vtfnqw__original/img/_7B0V-HhV9k5AsxgIMM902Wyygo=/0x0/filters:format(jpeg)/pic49693.jpg,"Ages 6 and up.  2 to 6 players. To begin with, all the space dominoes are placed in the cotton bag and mixed up so that nobody can see them. The bag contains 39 pieces. If four players are playing, each player discreetly takes 9 pieces each and puts them behind his/her hidden cardboard plate so that none of the other players can see them. Each player plays when it is his or her turn. When the players can no longer put elements down, all the remaining points are worked out for every player.  After 10 games have been played, the one who has the most points wins the whole game. Fun educational game based on observation, sums, and the occupying of a 3-dimensional space.&#10;&#10;"
12311,,"The goal of ROUP is to split up the former Communist monopoly and sell properties to Private Ownership.&#10;&#10;Each player rotates turns as the &quot;Auctioneer&quot; and after that as the &quot;KGB.&quot;&#10;&#10;Basic Steps:&#10;Step 1) Auctioneer rolls Red and White Dice.&#10;Step 2) Auctioneer's Plane flies directly to property.&#10;Step 3) KGB moves in any direction along street squares according to Red Die # rolled by Auctioneer attempting to &#10;a) steal commission of property sold, &#10;b) steal the rent from property already owned, or &#10;c) move to a Black Market square for choice of Black Market Card or 2 million Rubles from bank.&#10;Step 4) Property is sold at auction.  Card serves as deed.&#10;Step 5) Auctioneer collects Commission from Old Commie Bank (or pays rent to a property owner if property is already owned).&#10;&#10;The game ends when:&#10;A) a player or team wins by owning any three TRIPLE RENT COLOR FAMILY SETS or&#10;B) the &quot;Old Commie Bank&quot; goes broke.  In this case the richest player (Ultimate Capitalist) is the winner.&#10;&#10;"
12312,https://cf.geekdo-images.com/8tL387UZJJggTRJzlyheag__original/img/x18ojAgNXE8_dkazkTpm3uIbmJU=/0x0/filters:format(jpeg)/pic472715.jpg,"The Gamemaster (called Umpire in the rules) asks each player a question. The first question is worth one dollar. Each correct answer after the first question is worth double. The top prize is sixty-four dollars. A wrong answer ends the first part of the game for a player and forces that player to surrender all winnings to the &quot;Jack Pot Fund.&quot;&#10;&#10;After all players have had a chance to play, each player will have to answer one final question asked of the entire group. All who respond correctly split the &quot;Jack Pot Fund.&quot; The player with the most money wins.&#10;&#10;Which question to be asked is determined by the gameboard which is a giant spinner.&#10;&#10;The game is based on a popular radio show which was adapted for television and renamed &quot;The $64,000 Question.&quot;&#10;&#10;"
12313,,"Time to sharpen up your axes and get your swords polished, Demonblade games takes you on a no-holds-barred tour through the world of the Scumdogs of the Universe, and in the process shows you how to bring all the carnage, misery and destruction to your very own tabletop. Designed as part of the War Engine system, GWAR:Rumble In Antarctica is easy to learn, fun to play and allows you to incorporate anything your sick little minds can dream up into your games. Have fun and remember it's only a game... or is it?&#10;&#10;"
12314,https://cf.geekdo-images.com/LsHQVOi-ltVITRAEpVCdXQ__original/img/MCfGRvqiVKJupbyQwUj-tZ9VUv4=/0x0/filters:format(jpeg)/pic335454.jpg,
12315,,"The game comes with five twelve-sided dice. Each face of each die represents one card of a standard deck of playing card plus eight wild cards.&#10;&#10;In turn, a player rolls all the dice. A player has three chances to roll the best possible poker-type hand.&#10;&#10;The Oddsmaker Program Selector gives the odds of improving each roll at a glance.&#10;&#10;"
12316,https://cf.geekdo-images.com/yg4JQLL8A_FunV3MGtzBpw__original/img/aWGGBitKjb6NFOT9AD9MJGqwnzE=/0x0/filters:format(jpeg)/pic54158.jpg,"Here's a description of the game from Cocktail Games:&#10;&#10;Sky My Husband is a collaborative effort from Guillaume Blossier and Jean-Loup Chiflet. A while back, Guillaume showed us a prototype of a game in which players had to find English expressions through their literal French translations - averaging about two clues per phrase. This idea, highly innovative in terms of a game, went over very well in tests. We were reminded of the book &quot;Sky my Husband&quot;, which was based on a similar idea (it included literal French translations of English phrases) - and sold over 200,000 copies over the last 10 years. It seemed logical to us, then, to contact the book's author, Jean-Loup Chiflet. He was excited by the concept and helped us out greatly with the content, as well as getting permission from the book's publisher to use the same title.&#10;&#10;In the game, 460 expressions, each with two clues, are read out by a player. The object of the game is to deduce the original English phrase the fastest. As an example, one English phrase is &quot;Tie-break&quot;. The literal French translation &quot;Repos de cravate&quot; (Resting tie) is provided, along with two clues: Tennis and Deciding Game.&#10;&#10;"
12317,,"Here's a description of the game from Cocktail Games:&#10;&#10;Brouhaha is a game by Jean-Marc Pauly which interested us because of it's intergenerational nature, as well as the pleasant ambiance it generates around the table. The basis of the game is simple but highly effective: 42 Animal cards (21 pairs) and 4 Hunter cards are dealt out among the players. Each player then takes his cards into his hand without showing them to anyone else. Each player chooses a card and plays it face-down in front of himself. He then tries to mimic the cry of the animal on the card he has chosen, with the objective of finding its mate.&#10;&#10;As soon as two players think they share the same animal, the both knock the center of the table. This action suspends the game while the players check to see if they were correct. If they were, they are awarded their respective cards.&#10;&#10;At any time, a player who can't find his mate may take his card back into his hand and play out another, henceforth imitating the cry of the new card's animal instead.&#10;&#10;Players have to watch out for the Hunters, which let one imitate an animal's call...&#10;&#10;A game of hilarious cacophony for players 7 and up and which has an impressive variant intended for 42 players.&#10;&#10;"
12318,https://cf.geekdo-images.com/054ImwbpNUnlEwI8ejhQqQ__original/img/dAzT-y5OQuG5ggK7Xvxw-fDJUUA=/0x0/filters:format(jpeg)/pic4555929.jpg,
12319,,"Not to be confused with a later, totally different game of the same name, Quandary, as published by Spears, is a two-player abstract traversal race game. Following an initially random placement of their four pawns (using cards), each player moves one pawn in turn one space forward (either orthogonally or diagonally) if and only if the space to which the pawn is moving is of the same color as the space in front of at least one of the opposing pawns. The first player to get one pawn to the far end of the board wins.&#10;&#10;"
12320,https://cf.geekdo-images.com/FyOmstIL4VQSFbqCUTfqdQ__original/img/rEqOTT5Xu8E7lVsQFZIjNg8lxFo=/0x0/filters:format(jpeg)/pic105125.jpg,"From the Publisher:&#10;&#10;A strategy game about operating Coast Guard Ice Breakers in the Arctic! Our job is to open up frozen waterways for Freighters, Supply Ships, Tankers and Military Craft. We succeed if we get all 12 Ships to their respective Destinations before the Ice becomes so thick and widespread that we are prevented from further action.&#10;&#10;Satellite Ice Reports keep us informed so we can plan our strategies. But Ice forms quickly. And we have to be careful, because even Ice Breakers get stuck!&#10;&#10;Includes:&#10;&#10;17 x 17&quot; board, rules for introductory and full games, ice report chart, ice/water pieces, ships, ice reports, Coast Guard action cards.&#10;&#10;"
12321,,"The fishermen in the Chinese islands must catch six kinds of fish and bring those to market. Each fish requires its own kind of bait, so it's not as easy as it looks &mdash; not to mention that sharks can also take the bait! The weather might get worse, and you might run out of fuel or bait, so look to your fellow fishermen to ensure that together you can get those fish to market.&#10;&#10;On a turn in Archipel, you navigate between the islands. If you're at a harbor, you can get fresh bait, fuel and other equipment, and you can also have a look at the weather. Weather tokens are placed on the game board, making sailing more difficult between storms. Fish are placed face down on the game board. To try to catch one, you flip it over to reveal it, but you must have the right bait on board. You'll possibly then need to sell the fish at market immediately as your boat can hold only so much fuel.&#10;&#10;If all the villages are fed and all players return home, then the day was a success and they've won; if no more fish can be delivered, however, they'll have to try again another day.&#10;&#10;"
12322,https://cf.geekdo-images.com/ENhRLvtpEmm-A-kB4qtjTw__original/img/MMzL7uM-u30JM3DxpnNgAydOZ80=/0x0/filters:format(jpeg)/pic614930.jpg,
12323,,Players race to go from start to finish on a gameboard. The first to the finish plays the quiz. This player draws a chance card to determine the amount of money needed to win the quiz. A player starts with $50 and risks increments of $50 on every question. If the player fails to reach the target amount by five questions and player still has a one-in-four chance of winning with a random draw from &ldquo;the Heartline Phone.&rdquo; The first to complete three of the chance cards is the winner.&#10;&#10;The game is loosely based on a television series.&#10;&#10;
12324,https://cf.geekdo-images.com/R3D9f1_l3g3S4w_8jil9Vg__original/img/MKFYLU0XhDzzNuSQ-NesSJSmq4U=/0x0/filters:format(jpeg)/pic52163.jpg,
12325,,"In&#226;&#128;&#175;Perpetual&#226;&#128;&#175;Commotion, each player has their own deck of color&#226;&#128;&#145;coded cards and races everyone else to play them into shared piles at the table&rsquo;s center&mdash;no turns, just non&#226;&#128;&#145;stop action. You begin by dealing yourself five cards face&#226;&#128;&#145;up (your &ldquo;Front Five&rdquo;) and stacking thirteen more face&#226;&#128;&#145;down (your &ldquo;Feeders&rdquo;) beside them. The rest become your draw pile, called &ldquo;Playmakers.&rdquo;&#10;&#10;When someone shouts &ldquo;Go!&rdquo;, everyone slaps down any playable card onto one of the central piles&mdash;each pile starts with a wild &ldquo;Start&rdquo; card, then builds from 2 up to 12 in its color before ending with a &ldquo;Stop.&rdquo; Each time you empty a spot in your Front Five, you refill it from your Feeders. When you can&rsquo;t play from your Front Five you turn over three cards from your Playmakers, looking only at the top card, and keep cycling through until you find something to play.&#10;&#10;As soon as you discard your last Feeder, you call &ldquo;Out!&rdquo; to freeze the round. Then comes scoring: you earn one point for every card you placed in the center but lose two points for each card still in your Feeders&mdash;and you receive a small bonus for being first &ldquo;Out!&rdquo; After the first round, that bonus changes each time based on an eight&#226;&#128;&#145;sided die: sometimes you gain extra points, sometimes you even double your round total, and on rare rolls you suffer a &ldquo;Perpetual Demotion,&rdquo; losing points instead.&#10;&#10;Keep the chaos going round after round; the first to reach 150&#226;&#128;&#175;points wins the commotion!&#10;Expanded by:&#10;&#10;    Perpetual Commotion Black & White Edition Cards&#10;    Perpetual Commotion Silver & Gold Edition Cards&#10;&#10;&#10;"
12326,https://cf.geekdo-images.com/_jicBoJuWFg8OOYhzR9twg__original/img/af8Z7w8Q-gIYUIjnckgzlAg-DQA=/0x0/filters:format(jpeg)/pic73289.jpg,
12327,,"Babelation cards are quartered with Nations, Capitals, Official Languages and Monetary Units on each. Each player receives an Index to tell which quarters match on various cards. The instructions list rules for playing three different games with the cards, however many games played with a standard deck of cards could be played with Babelation cards.&#10;1. Pico - A gin rummy type game for two players.&#10;2. Crazy Azy - A Crazy Eight&rsquo;s type game for 2-6 players.&#10;3. Mates - A Concentration type game for younger players.&#10;An example of how the cards work is as follows: Card 69 has Italy in the Country quarter, card 26 has Rome in the Capital quarter, card 25 has Italian in the Language quarter and card 56 has Lira in the Monetary unit quarter. In order to win, you would have to collect four these cards to complete a set.&#10;&#10;"
12328,https://cf.geekdo-images.com/tq3cHqKL4kyyAkJ-kMSf9w__original/img/Wvq4TOPTiRpkvUbONIEz26xTnUU=/0x0/filters:format(jpeg)/pic139821.jpg,
12329,,"Cipangu (pronounced Chi-pon-gu) is the name given to the island of Japan by Marco Polo in his journals.&#10;  As the introduction on the rules sheet quotes, Marco Polo described Cipangu as a land &quot;...abounding in gold and producing vast quantities of the largest and finest pearls, together with a variety of precious stones, so that, in fact, it abounds in riches&quot;.&#10;&#10;Each player is sending their sailing ship out into the uncharted ocean in an attempt to find the riches of Cipangu, and other smaller islands, and return them to their home port. These riches are represented in the game by shiny gold counters which look very much like wide, flat gold bars. Only gold returned to one's port counts for victory.&#10;&#10;The sailing ship's hulls are printed on cardboard sheets, to be punched out and folded into shape. Three wooden dowel masts are inserted through punched-out, printed paper sails and then through the decks of the ships.&#10;&#10;The board is a blank diagonal grid of 32 square ocean spaces with the four players' home ports in the corners. The 29 Sea Square tiles are shuffled and 32 of them placed face down on the spaces. There are four each of Island, Reef, Ship and Monster tiles plus the Cipangu tile, a Fog tile, and a Storm tile. All others are open sea.&#10;&#10;There are four Encounter Decks, cards from which are drawn when a ship discovers Islands, Reefs, Ships, and Monsters. The monsters are the only fantasy element of the game. Their artwork is drawn in the style of the &quot;Here There Be Monsters&quot; of the old mapmakers. Each deck has cards with good or bad results: gold bars, extra sailors, repairs, attacks by monsters or pirates, grounding on reefs, being attacked or helped by island natives, etc.&#10;&#10;Each ship starts with three sailors and three masts. The markers for the sailors are actually the familiar plastic push-pins available in any dollar store, without the pin. Both sailors and masts serve as 'hit-point' indicators: any ship that loses all masts or all sailors is sunk. Movement range is determined by current no. of masts to a maximum of 3 spaces.&#10;&#10;There is a wind direction spinner which is a 'top' made up of an octagonal direction card with a wood dowel through the center. This is spun to determine which direction a player's ship cannot sail that turn.&#10;&#10;Players move around the board, turning over the sea tiles and trying to accumulate gold and survive the various events that can damage their ship. When the one Cipangu tile is discovered, players can get 3 gold bars each turn they stay there.&#10;&#10;Players can also 'Turn Pirate' by attacking another player's ship or port. 1d6's are rolled and compared, low roller in each round loses one sailor, ties cause both ships to lose a mast. Ships that lose all sailors are plundered of their gold and sunk. Ships that lose all masts just sink.&#10;  Combat against ports is handled the same way except ports have no masts. Players can leave extra sailors in port as defense forces. Sunk ships are replaced, and damaged ships repaired, by paying one gold bar and continuing with a new/fixed 3-mast, 3-sailor ship from your port.&#10;&#10;Once the last Sea Tile is turned over, the game ends and Gold Bars are counted up to determine a victor.&#10;&#10;"
12330,https://cf.geekdo-images.com/xm7X9NVkSrEXfXyhWmdtjQ__original/img/BFXxR8qYrjUlqQVQ9Owz8hKkYSE=/0x0/filters:format(jpeg)/pic183662.jpg,
12331,,"In Moose Quest, you help your moose herd migrate, while maintaining their numbers against predators and the terrain you attempt to cross. The more dangerous the terrain, the more it's worth. Each player heads a herd, and attempts to take the most valuable course to Green Pastures.&#10;&#10;The trek is represented by a deck of cards with Green Pastures at the bottom. There is also a moose deck from which your herds may grow. Occasionally (upon rolling doubles), you will have a &quot;moosehap&quot;: These may be immediate events, or predators you can save to unleash on a competing herd.&#10;&#10;"
12332,https://cf.geekdo-images.com/yYRFPKgH3q1ednvTQSKYPw__original/img/kAxncLsqBltMqUlq2zm0FfAGe_U=/0x0/filters:format(jpeg)/pic1902593.jpg,
12333,,"Now the trumpet summons us again, not as a call to bear arms, though arms we need; not as a call to battle, though embattled we are &ndash; but a call to bear the burden of a long twilight struggle. &ndash; John F. Kennedy&#10;&#10;In 1945, unlikely allies toppled Hitler's war machine, while humanity's most devastating weapons forced the Japanese Empire to its knees in a storm of fire. Where once there stood many great powers, there then stood only two. The world had scant months to sigh its collective relief before a new conflict threatened. Unlike the titanic struggles of the preceding decades, this conflict would be waged not primarily by soldiers and tanks, but by spies and politicians, scientists and intellectuals, artists and traitors.&#10;&#10;Twilight Struggle is a two-player game simulating the forty-five year dance of intrigue, prestige, and occasional flares of warfare between the Soviet Union and the United States. The entire world is the stage on which these two titans fight to make the world safe for their own ideologies and ways of life. The game begins amidst the ruins of Europe as the two new &quot;superpowers&quot; scramble over the wreckage of the Second World War, and ends in 1989, when only the United States remained standing.&#10;&#10;Twilight Struggle inherits its fundamental systems from the card-driven classics We the People and Hannibal: Rome vs. Carthage. It is a quick-playing, low-complexity game in that tradition. The game map is a world map of the period, whereon players move units and exert influence in attempts to gain allies and control for their superpower. As with GMT's other card-driven games, decision-making is a challenge; how to best use one's cards and units given consistently limited resources? Event cards add detail and flavor to the game. They cover a vast array of historical happenings, from the Arab-Israeli conflicts of 1948 and 1967, to Vietnam and the U.S. peace movement, to the Cuban Missile Crisis and other such incidents that brought the world to the brink of nuclear annihilation. Subsystems capture the prestige-laden Space Race as well as nuclear tensions, with the possibility of game-ending nuclear war.&#10;&#10;TIME SCALE:     approx. 3-5 years per turn&#10;MAP SCALE:     Point-to-point system&#10;UNIT SCALE:     Influence markers&#10;&#10;"
12334,https://cf.geekdo-images.com/0U_DbvV7Xo4NTUsHjcCi1w__original/img/jW5XWofS2itsdopt7SwA41c2-Co=/0x0/filters:format(jpeg)/pic50110.jpg,
12335,,"Operation Market Garden was the audacious plan to seize a bridgehead across the Rhine River in Holland, 1944.  Though scale is not mentioned it appears to be operational level (the Allies have fourteen &quot;5-3&quot; parachute units, as a gauge).&#10;&#10;This game features weather effects and special rules for airborne drops, armor attack and engineers.  Optional rules include a &quot;Short Hook&quot; objective for the Allies occupying the towns of Goch and Doetinchhem instead of closure to the North Sea.&#10;&#10;238 die cut counters (Allies are blue, Germans are red), 12-page rulebook, a 24&quot; x 28&quot; three color map sheet, and a cover sheet. A six-sided die is needed as well as some paper and pencils.&#10;&#10;"
12336,https://cf.geekdo-images.com/8T3gPXL25A5QPgNPEzYNRA__original/img/NBry1efz2TgNrwcm5ysmvzNdFf8=/0x0/filters:format(jpeg)/pic5664610.jpg,
12337,,"Beautiful map and beautiful, readable counters in a remake of a game originally part of Four Battles in North Africa.&#10;&#10;Rules for combat were modified from the original. The game simulates the battles between Allied and Axis forces near the end of the North African campaign of World War II. Little historical background is included in the game materials.&#10;&#10;"
12339,https://cf.geekdo-images.com/xITftVAOfwKgNmNpjzMtPw__original/img/4NUaFVzrlRIwD3i1g8AiUHdKkSE=/0x0/filters:format(jpeg)/pic892580.jpg,
12340,https://cf.geekdo-images.com/VItA6EuCVxjhf556NhqRZg__original/img/axXbgpxZgnt6mOerpoCaA1ssBOI=/0x0/filters:format(jpeg)/pic50107.jpg,"Now you can test your knowledge of THE SOPRANOS, HBO's critically-acclaimed mob drama. 1,000 trivia questions will challenge you on your program knowledge and &quot;Mob Speak&quot; too.  Place bets on which questions you and your friends can answer correctly. Five levels of difficulty make it easy for even casual viewers to play against the most seasoned fans of THE SOPRANOS. It's trivia. Redefined.&#10;&#10;"
12341,,
